ID,Quotation Name,Document,Quotation Content,Comment,Codes,Reference,Density,Modified by
41:9,ideally Cassandra should frst try to load  the native impl (if the JAR…,CASSANDRA-5038,"ideally Cassandra should frst try to load  the native impl (if the JAR includes bindings for the host architecture), then the unsafe java  impl (if the JVM supports sun.misc.Unsafe) and then the pure Java impl",,Architectural design configuration,4:562 - 4:770,1,arjan
41:10,(which is unfortu-  nately ~40% slower at compressing and ~30% slower…,CASSANDRA-5038," (which is unfortu-  nately ~40% slower at compressing and ~30% slower at decompressing than the unsafe impl).
",,Architectural solution benefits and drawbacks,4:771 - 4:882,1,arjan
41:11,"I noticed in your patch that you are using the ""unknown size"" version…",CASSANDRA-5038,"I noticed in your patch that you are using the ""unknown size"" version of the decompres-  sor. It can unfortunately be slightly slower than the normal decompressor.",,Architectural solution benefits and drawbacks,4:883 - 4:1045,1,arjan
41:12,"On large blocks,  it can be faster to write the original length at the…",CASSANDRA-5038,"On large blocks,  it can be faster to write the original length at the beginning of the compressed streams to  be able to use the normal decompressor to decompress data.
",,"Architectural design configuration
Architectural tactics",4:1047 - 4:1217,2,arjan
41:25,tjake,CASSANDRA-5038,tjake,,Comment,4:1329 - 4:1333,1,arjan
41:13,"Cool, yeah",CASSANDRA-5038,"Cool, yeah",,Architectural solution benefits and drawbacks,4:1348 - 4:1357,1,arjan
41:14,I’d suggest you add a  simple way for us to pick the best compressor f…,CASSANDRA-5038,"I’d suggest you add a  simple way for us to pick the best compressor for our node.
",,User requirement,4:1590 - 4:1673,1,arjan
41:26,jpountz,CASSANDRA-5038,jpountz,,Comment,4:1677 - 4:1683,1,arjan
41:15,"It needs to be exact, or decompression will fail. An option to be able…",CASSANDRA-5038,"It needs to be exact, or decompression will fail. An option to be able to use it is to write  the original length as an int (or better as a variable-length int) before the compressed bytes.
Upon decompression, frst read the original length and then use this original length to call  the ""known size"" decompressor.
",,Architectural design configuration,4:1870 - 4:2185,1,arjan
41:16,Another feature of these compressors you might be interested in is tha…,CASSANDRA-5038,"Another feature of these compressors you might be interested in is that you can provide  them with an output bufer of any length and they will succeed only if they managed to gen-  erate an output which is small enough (and they will fail as soon as they know they won’t  make it). So for example, you could decide to write the raw bytes instead of the compressed  bytes if LZ4 didn’t manage to compress your data by more than 10%:  3
1 final int maxAcceptableCompressedLength = originalLength * 90 / 100;  2 try {  3 dest[0] = 0; // means compressed  4 final int compressedLength = compressor.compress(src, 0, originalLength, dest,  1, maxAcceptableCompressedLength);  5 return 1 + compressedLength;  6 } catch (LZ4Exception e) {  7 dest[0] = 1; // means not compressed  8 System.arraycopy(src, 0, dest, 1, originalLength);  9 return 1 + originalLength;  10 }  (Only the native LZ4 HC impl doesn’t support this feature.)",,Architectural solution benefits and drawbacks,4:2481 - 5:486,1,arjan
41:27,tjake,CASSANDRA-5038,tjake,,Comment,5:492 - 5:496,1,arjan
41:17,New version that encodes the length of each chunk in frst 4 bytes (did…,CASSANDRA-5038,New version that encodes the length of each chunk in frst 4 bytes (didn’t use vints),,Architectural component behavior and structure,5:499 - 5:582,1,arjan
41:28,tjake,CASSANDRA-5038,tjake,,Comment,6:553 - 6:557,1,arjan
41:18,The current version as submitted is good.,CASSANDRA-5038,"The current version as submitted is good.
",,Architectural solution benefits and drawbacks,6:676 - 6:718,1,arjan
41:29,jpountz,CASSANDRA-5038,jpountz,,Comment,6:810 - 6:816,1,arjan
41:19,I fnally managed to deploy an artifact with pre-built JNI bindings for…,CASSANDRA-5038," I fnally managed to deploy an artifact with pre-built JNI bindings for some ma-  jor platforms (win32/amd64, linux/i386, linux/amd64 and darwin/x86_64) to Maven Cen-  tral (http://repo1.maven.org/maven2/net/jpountz/lz4/lz4/1.1.0/).",,Architectural design configuration,6:818 - 6:1049,1,arjan
41:20,This should help pro-  vide better performance on these platforms (see…,CASSANDRA-5038,"This should help pro-  vide better performance on these platforms (see compression and decompression benchmarks:  http://jpountz.github.com/lz4-java/1.1.0/lz4-compression-benchmark/ http://jpountz.github.com/lz4-  java/1.1.0/lz4-decompression-benchmark/).
",,Architectural tactics,6:1051 - 6:1307,1,arjan
41:30,tjake,CASSANDRA-5038,tjake,,Comment,6:1873 - 6:1877,1,arjan
41:21,I believe Snappy has slightly higher compression but I don’t see a rea…,CASSANDRA-5038,"I believe Snappy has slightly higher compression but I don’t see a reason to use it. I  don’t really feel strongly about it either way.
",,Architectural solution benefits and drawbacks,6:1880 - 6:2016,1,arjan
41:31,carlyeks,CASSANDRA-5038,carlyeks,,Comment,6:2021 - 6:2028,1,arjan
41:22,One beneft to LZ4 is that the unsafe implementation isn’t much slower…,CASSANDRA-5038,"One beneft to LZ4 is that the unsafe implementation isn’t much slower than the  native version; if we end up going to an incompatible version (or people run on some platform  that Snappy/LZ4 native hasn’t been created for), they won’t have nearly the slowdown that  Snappy has (or at least had, not sure if they’ve addressed that).
",,Architectural solution benefits and drawbacks,6:2031 - 6:2363,1,arjan
41:32,jpountz,CASSANDRA-5038,jpountz,,Comment,6:2390 - 6:2396,1,arjan
41:23,For your information [~cowtowncoder] ran his JVM compressor benchmark…,CASSANDRA-5038,"For your information [~cowtowncoder] ran his JVM compressor benchmark again recently,  and indeed, it shows good performance numbers for both the native and the Java impl of  LZ4: https://twitter.com/cowtowncoder/status/343881969697951744",,Architectural solution benefits and drawbacks,6:2738 - 6:2975,1,arjan
42:1,Cassandra/Hadoop does not support current Hadoop releases,CASSANDRA-5201,Cassandra/Hadoop does not support current Hadoop releases,,Run-time quality issues,3:52 - 3:108,1,arjan
42:2,Using Hadoop 0.22.0 with Cassandra results in the stack trace below. I…,CASSANDRA-5201,"Using Hadoop 0.22.0 with Cassandra results in the stack trace below.
It appears that version 0.21+ changed org.apache.hadoop.mapreduce.JobContext  from a class to an interface.
Exception in thread ""main"" java.lang.IncompatibleClassChangeError: Found interface org.apache.hadoop.mapreduce.JobC  but class was expected  at org.apache.cassandra.hadoop.ColumnFamilyInputFormat.getSplits(ColumnFamilyInputFormat.java:103)  at org.apache.hadoop.mapreduce.JobSubmitter.writeNewSplits(JobSubmitter.java:445)  at org.apache.hadoop.mapreduce.JobSubmitter.writeSplits(JobSubmitter.java:462)  at org.apache.hadoop.mapreduce.JobSubmitter.submitJobInternal(JobSubmitter.java:357)  at org.apache.hadoop.mapreduce.Job$2.run(Job.java:1045)  at org.apache.hadoop.mapreduce.Job$2.run(Job.java:1042)  at java.security.AccessController.doPrivileged(Native Method)  at javax.security.auth.Subject.doAs(Subject.java:415)  at org.apache.hadoop.security.UserGroupInformation.doAs(UserGroupInformation.java:1153)  at org.apache.hadoop.mapreduce.Job.submit(Job.java:1042)  at org.apache.hadoop.mapreduce.Job.waitForCompletion(Job.java:1062)  at MyHadoopApp.run(MyHadoopApp.java:163)  at org.apache.hadoop.util.ToolRunner.run(ToolRunner.java:69)  at MyHadoopApp.main(MyHadoopApp.java:82)  at sun.refect.NativeMethodAccessorImpl.invoke0(Native Method)  at sun.refect.NativeMethodAccessorImpl.invoke(NativeMethodAccessorImpl.java:57)  at sun.refect.DelegatingMethodAccessorImpl.invoke(DelegatingMethodAccessorImpl.java:43)  at java.lang.refect.Method.invoke(Method.java:601)  at org.apache.hadoop.util.RunJar.main(RunJar.java:192)",,Run-time quality issues,3:128 - 3:1729,1,arjan
42:51,jeromatron,CASSANDRA-5201,jeromatron,,Comment,4:194 - 4:203,1,arjan
42:3,The current stable hadoop version is still the 1.0.x line according to…,CASSANDRA-5201,"The current stable hadoop version is still the 1.0.x line according to http://hadoop.apache.org/releases  As long as the 1.0.x support isn’t adversely afected, I would think a patch to provide support  for all hadoop versions would be welcome.
",,"Architectural solution benefits and drawbacks
Assumptions",4:206 - 4:450,2,arjan
42:52,brandon.williams,CASSANDRA-5201,brandon.williams,,Comment,4:454 - 4:469,1,arjan
42:4,I think the last time I looked into this I couldn’t fnd a way to suppo…,CASSANDRA-5201," I think the last time I looked into this I couldn’t fnd a way to support  both versions, so we’re either stuck with 0.21+ being broken, or breaking it for everyone  that’s on a lower version already.
",,"Assumptions
Motivation of design issue",4:471 - 4:672,2,arjan
42:53,dbrosius,CASSANDRA-5201,dbrosius,,Comment,4:710 - 4:717,1,arjan
42:5,what if the hadoop directory was split out into two separate sub-proje…,CASSANDRA-5201,"what if the hadoop directory was split out into two separate sub-projects which  produced two separate jars, thus a jar for old hadoop support and one for new hadoop. then  folks could choose which jar to add to the cassandra classpath?
",,Architectural design configuration,4:720 - 4:957,1,arjan
42:54,brandon.williams,CASSANDRA-5201,brandon.williams,,Comment,4:961 - 4:976,1,arjan
42:6,"That’s not a bad idea,",CASSANDRA-5201,"That’s not a bad idea, ",,Architectural solution benefits and drawbacks,4:979 - 4:1001,1,arjan
42:55,genx7up,CASSANDRA-5201,genx7up,,Comment,4:1284 - 4:1290,1,arjan
42:7,We are using the newer 0.23.x & are facing this integration issue.,CASSANDRA-5201,We are using the newer 0.23.x & are facing this integration issue.,,Run-time quality issues,4:1293 - 4:1358,1,arjan
42:56,dbrosius,CASSANDRA-5201,dbrosius,,Comment,4:1483 - 4:1490,1,arjan
42:8,initial patch against 1.2  - pulls hadoop code into src/hadoop/hadoop-…,CASSANDRA-5201,"initial patch against 1.2  - pulls hadoop code into src/hadoop/hadoop-legacy  - replicates that into src/hadoop/hadoop-new with changes for api changes.
pulls new hadoop dependencies and builds separate jars for each.
which jar you run against is still manual... command line switch?
posted version a so i didn’t lose stuf.
3
This uses 0.23.6 versions of jars,",,Architectural design configuration,4:1493 - 5:34,1,arjan
42:9,which i assume is compatible with the 2.0a versions of  the api.,CASSANDRA-5201,"which i assume is compatible with the 2.0a versions of  the api.
",,Architectural solution benefits and drawbacks,5:36 - 5:101,1,arjan
42:57,jeromatron,CASSANDRA-5201,jeromatron,,Comment,5:106 - 5:115,1,arjan
42:11,I wonder if it would be preferable,CASSANDRA-5201,I wonder if it would be preferable,,"Architectural solution benefits and drawbacks
Assumptions",5:118 - 5:151,2,arjan
42:10,"have all of the code in tree in the same  jar still, but have diferent…",CASSANDRA-5201,"have all of the code in tree in the same  jar still, but have diferent package paths, like org.apache.cassandra.hadoop (for backwards  compatibility) and org.apache.cassandra.hadoop2. ",,Architectural design configuration,5:156 - 5:339,1,arjan
42:58,dbrosius,CASSANDRA-5201,dbrosius,,Comment,5:570 - 5:577,1,arjan
42:12,probably could be done. here’s some ’issues’ with that approach. 1) ex…,CASSANDRA-5201,"probably could be done. here’s some ’issues’ with that approach.
1) external code won’t work against both versions with the same code base. Obviously  the modifcations are insignifcant, (packages) but still.
2) Makes the build.xml fle marginally more complicated as you have to use <exclude> ele-  ments in the build  3) Building in IDEs is complicated as you need to add resource excludes, since these packages  need to be built as a separate project (at least one of them does).
4) If you have two IDE projects targetting the same classes dir, cleaning one project cleans  the other.
",,Architectural solution benefits and drawbacks,5:833 - 5:1422,1,arjan
42:59,mck,CASSANDRA-5201,mck,,Comment,5:1479 - 5:1481,1,arjan
42:13,What about simply putting the hadoop2 package into a github project?,CASSANDRA-5201,What about simply putting the hadoop2 package into a github project?,,Architectural design configuration,5:1484 - 5:1551,1,arjan
42:14,"it would become available for others to use, and c* can switch to it w…",CASSANDRA-5201,"it would become available for others to use, and c* can switch to it when they feel ready to  drop support for hadoop-0.20",,Architectural solution benefits and drawbacks,5:1554 - 5:1675,1,arjan
42:15,otherwise i’m in favour of separate jar fles (apache-cassandra-hadoop-…,CASSANDRA-5201,"otherwise i’m in favour of separate jar fles (apache-cassandra-hadoop-legacy-XXX.jar and  apache-cassandra-hadoop-XXX.jar). c* already bundles too much into the one jar fle IMHO.
",,Architectural solution benefits and drawbacks,5:1678 - 5:1857,1,arjan
42:60,mck,CASSANDRA-5201,mck,,Comment,5:1862 - 5:1864,1,arjan
42:16,Done,CASSANDRA-5201,Done,,Architectural solution benefits and drawbacks,5:1951 - 5:1954,1,arjan
42:61,jbellis,CASSANDRA-5201,jbellis,,Comment,5:2412 - 5:2418,1,arjan
42:17,How common is hadoop2 usage now? Can we drop hadoop1 for 2.1?,CASSANDRA-5201,How common is hadoop2 usage now? Can we drop hadoop1 for 2.1?,,Architectural design configuration,5:2421 - 5:2481,1,arjan
42:62,kkrugler,CASSANDRA-5201,kkrugler,,Comment,6:5 - 6:12,1,arjan
42:18,Re Hadoop 1.x vs. Hadoop 2.x - most companies I see are using a 1.x ve…,CASSANDRA-5201,"Re Hadoop 1.x vs. Hadoop 2.x - most companies I see are using a 1.x version  of Hadoop. Usage of Hadoop 2.x is ramping up fast, but I’m guessing it will be at least  another year (probably more) before you’d want to start thinking about phasing out support  for Hadoop 1.x",,Architectural solution benefits and drawbacks,6:15 - 6:286,1,arjan
42:63,nyo,CASSANDRA-5201,nyo,,Comment,6:363 - 6:365,1,arjan
42:19,Why dropping support for old hadoop versions while you can just use a…,CASSANDRA-5201,Why dropping support for old hadoop versions while you can just use a diferent pack-  age name (e.g org.apache.cassandra.hadoop2.<SomeClass>)?,,"Architectural design configuration
Architectural solution benefits and drawbacks",6:368 - 6:509,2,arjan
42:20,"Imo, the code in here:  https://github.com/michaelsembwever/cassandra-…",CASSANDRA-5201," Imo, the code in here:  https://github.com/michaelsembwever/cassandra-hadoop/ should just be merged with main-  stream implementation",,Architectural design configuration,6:510 - 6:643,1,arjan
42:21,so both 1.x and 2.x users can be happy,CASSANDRA-5201,so both 1.x and 2.x users can be happy,,Architectural solution benefits and drawbacks,6:646 - 6:683,1,arjan
42:22,Or you can indeed make it a lot more complex,CASSANDRA-5201,Or you can indeed make it a lot more complex,,Architectural solution benefits and drawbacks,6:687 - 6:730,1,arjan
42:23,by merging the 1.x and 2.x compatible  implementations and deciding wh…,CASSANDRA-5201,by merging the 1.x and 2.x compatible  implementations and deciding which one to use based on metadata obtained by polling the  cluster,,Architectural design configuration,6:732 - 6:866,1,arjan
42:24,but that is a bit too sophisticated,CASSANDRA-5201,but that is a bit too sophisticated,,Architectural solution benefits and drawbacks,6:869 - 6:903,1,arjan
42:25,"For most people the frst option, where they can  choose which package…",CASSANDRA-5201,"For most people the frst option, where they can  choose which package to use, would be sufcient.
",,Architectural solution benefits and drawbacks,6:906 - 6:1003,1,arjan
42:64,bcoverston,CASSANDRA-5201,bcoverston,,Comment,6:1907 - 6:1916,1,arjan
42:26,Ship two versions of their Hadoop integrations (one compiled for the o…,CASSANDRA-5201,"Ship two versions of their Hadoop integrations (one compiled for the old, and one compiled  for the new)",,Architectural design configuration,6:1999 - 6:2102,1,arjan
42:27,use a little refection to make things work across the board.,CASSANDRA-5201,"use a little refection to make things work across the board.
",,Architectural design configuration,6:2108 - 6:2169,1,arjan
42:28,I’m attaching a patch that uses the hadoopCompat subproject of elephan…,CASSANDRA-5201,I’m attaching a patch that uses the hadoopCompat subproject of elephantbird.,,"Architectural design configuration
Technology solution",6:2170 - 6:2245,2,arjan
42:29,This will  allow us to compile a single binary and run with the new an…,CASSANDRA-5201,"This will  allow us to compile a single binary and run with the new and old context objects.
",,Architectural solution benefits and drawbacks,6:2247 - 6:2340,1,arjan
42:65,dvryaboy,CASSANDRA-5201,dvryaboy,,Comment,7:110 - 7:117,1,arjan
42:30,"The EB HadoopCompat is what we use in production at Twitter, and plan…",CASSANDRA-5201,"The EB HadoopCompat is what we use in production at Twitter, and plan to  keep up to date in the foreseeable future.",,Other system architectural solutions,7:120 - 7:235,1,arjan
42:31,Glad you are fnding it useful.,CASSANDRA-5201,"Glad you are fnding it useful.
",,Architectural solution benefits and drawbacks,7:237 - 7:268,1,arjan
42:32,Seems generally applicable.,CASSANDRA-5201,"Seems generally applicable.
",,Architectural solution benefits and drawbacks,7:355 - 7:383,1,arjan
42:33,Also note that Tom White has a handy fndbugs plugin to look for Hadoop…,CASSANDRA-5201,Also note that Tom White has a handy fndbugs plugin to look for Hadoop incompati-  bility problems: https://github.com/tomwhite/hadoop-incompatibility-fndbugs-detector  Here’s how you’d use it: https://github.com/Parquet/parquet-mr/pull/77/fles,,"Architectural solution benefits and drawbacks
Technology solution",7:605 - 7:848,2,arjan
42:66,jeromatron,CASSANDRA-5201,jeromatron,,Comment,7:855 - 7:864,1,arjan
42:34,"As for me, it sounds like the EB (or if it makes more sense Parquet) d…",CASSANDRA-5201,"As for me, it sounds like the EB (or if it makes more sense Parquet) dependency makes  sense. ",,Architectural solution benefits and drawbacks,7:1035 - 7:1128,1,arjan
42:35,The hadoop incompatibility fndbugs detector also sounds great to inclu…,CASSANDRA-5201,The hadoop incompatibility fndbugs detector also sounds great to include to catch  anything before it is committed,,Architectural solution benefits and drawbacks,7:1129 - 7:1242,1,arjan
42:36,So I’m +1 on this approach.,CASSANDRA-5201,"So I’m +1 on this approach.
",,Architectural solution benefits and drawbacks,7:1245 - 7:1273,1,arjan
42:67,hkropp,CASSANDRA-5201,hkropp,,Comment,8:1640 - 8:1645,1,arjan
42:37,Use maven classifers for deployment,CASSANDRA-5201, Use maven classifers for deployment,,Technology solution,8:1784 - 8:1819,1,arjan
42:38,If this is used in a hadoop2 project you don’t want  hadoop1 dependenc…,CASSANDRA-5201,If this is used in a hadoop2 project you don’t want  hadoop1 dependencies and vice versa,,Architectural solution benefits and drawbacks,8:1822 - 8:1909,1,arjan
42:39,"This approach is used by Parquet, Avro and EB",CASSANDRA-5201,"This approach is used by Parquet, Avro and EB",,Other system architectural solutions,8:1912 - 8:1956,1,arjan
42:68,bcoverston,CASSANDRA-5201,bcoverston,,Comment,8:2334 - 8:2343,1,arjan
42:40,I agree that we need to do the second change,CASSANDRA-5201, I agree that we need to do the second change,,Architectural solution benefits and drawbacks,8:2355 - 8:2399,1,arjan
42:41,but I don’t see a  need to add deployment classifers. Because we’re us…,CASSANDRA-5201,"but I don’t see a  need to add deployment classifers. Because we’re using Hadoop-Compat (from EB) a single  binary will work for both.
",,Architectural solution benefits and drawbacks,8:2402 - 8:2537,1,arjan
42:42,but a single binary will  work for new and legacy deployments.,CASSANDRA-5201,"but a single binary will  work for new and legacy deployments.
",,Architectural design configuration,8:2604 - 8:2667,1,arjan
42:69,hkropp,CASSANDRA-5201,hkropp,,Comment,8:2672 - 8:2677,1,arjan
42:43,"I might be missing an important point, but Hadoop-Compat is nothing ot…",CASSANDRA-5201,"I might be missing an important point, but Hadoop-Compat is nothing other than  ContextUtil of hadoop2? It uses refection to test what’s on the classpath to decide how or  better what to return. I made it work with just using ContextUtil before I found this patch  here.
",,Architectural design configuration,8:2680 - 8:2951,1,arjan
42:44,Therefor the binary works fne for both (btw I would not consider it le…,CASSANDRA-5201,"Therefor the binary works fne for both (btw I would not consider it legacy!), if you manage  the dependencies on your own.
",,Architectural solution benefits and drawbacks,8:2952 - 8:3075,1,arjan
42:70,bcoverston,CASSANDRA-5201,bcoverston,,Comment,9:481 - 9:490,1,arjan
42:45,"Take a look at the code, it works for Hadoop1 and Hadoop2 without reco…",CASSANDRA-5201," Take a look at the code, it works for Hadoop1 and Hadoop2 without recompli-  ation, and without shipping two sets of dependencies. Basically it detects the current version  of Hadoop that you’re running and dynamically determines which TaskAttemptContext to  use, the Class, or the Interface",,Architectural design configuration,9:492 - 9:783,1,arjan
42:46,There’s no need to use deployment classifers to solve this  particular…,CASSANDRA-5201,"There’s no need to use deployment classifers to solve this  particular problem.
",,Architectural solution benefits and drawbacks,9:786 - 9:866,1,arjan
42:71,bcoverston,CASSANDRA-5201,bcoverston,,Comment,9:871 - 9:880,1,arjan
42:47,"Attaching a patch that brings in hadoop-compat, and adds the progressa…",CASSANDRA-5201,"Attaching a patch that brings in hadoop-compat, and adds the progressable  wrapper to it. I’m going to submit this upstream to the elephant bird project",,Architectural design configuration,9:883 - 9:1034,1,arjan
42:48,so we should  be able to remove this code and add the dependency in th…,CASSANDRA-5201, so we should  be able to remove this code and add the dependency in the future.,,Architectural solution benefits and drawbacks,9:1036 - 9:1115,1,arjan
42:72,bcoverston,CASSANDRA-5201,bcoverston,,Comment,9:1208 - 9:1217,1,arjan
42:49,"I removed the hadoop-compat dependency, as maven couldn’t resolve the…",CASSANDRA-5201,"I removed the hadoop-compat dependency, as maven couldn’t resolve the  dependencies, reverted to the old version.",,Architectural design configuration,9:1220 - 9:1332,1,arjan
42:50,This won’t stop our input/output formats from  being compatible with p…,CASSANDRA-5201,"This won’t stop our input/output formats from  being compatible with past and future releases.
",,Architectural solution benefits and drawbacks,9:1334 - 9:1429,1,arjan
43:5,Replace CustomHsHaServer with better optimized solution based on LMAX…,CASSANDRA-5582,Replace CustomHsHaServer with better optimized solution based on LMAX Disruptor,,Technology solution,3:52 - 3:130,1,arjan
43:1,I have been working on https://github.com/xedin/disruptor_thrift_serve…,CASSANDRA-5582,I have been working on https://github.com/xedin/disruptor_thrift_server,,Technology solution,3:150 - 3:220,1,arjan
43:2,consider it as sta-  ble and performant enough for integration with Ca…,CASSANDRA-5582,"consider it as sta-  ble and performant enough for integration with Cassandra.
",,Architectural solution benefits and drawbacks,3:226 - 3:305,1,arjan
43:3,Proposed replacement can work in both on/of Heap modes (depending if J…,CASSANDRA-5582,"Proposed replacement can work in both on/of Heap modes (depending if JNA is available) and  doesn’t blindly reallocate things,",,Technology solution,3:306 - 3:431,1,arjan
43:4,"which allows to resolve CASSANDRA-4265 as ""Won’t Fix"".",CASSANDRA-5582,"which allows to resolve CASSANDRA-4265 as ""Won’t Fix"".
",,Architectural solution benefits and drawbacks,3:433 - 3:488,1,arjan
43:27,vijay2win@yahoo.com,CASSANDRA-5582,vijay2win@yahoo.com,,Comment,3:828 - 3:846,1,arjan
43:6,I should say this patch is Awesome!,CASSANDRA-5582,"I should say this patch is Awesome!
",,Architectural solution benefits and drawbacks,3:868 - 3:904,1,arjan
43:7,"Overall i saw ""> 30%"" improvement at-least for most cases. The tests w…",CASSANDRA-5582,"Overall i saw ""> 30%"" improvement at-least for most cases. The tests where done with  32 Core Intel 128GB and SSD Drives",,Architectural tactics,3:905 - 3:1024,1,arjan
43:8,But i have to say it exposes other issues in the Storage Proxy layer..…,CASSANDRA-5582,"But i have to say it exposes other issues in the Storage Proxy layer...For example i was  noticing write failing silently without hints been stored etc, I did some digging and it was  not due to this patch though.
",,Run-time quality issues,4:12 - 4:226,1,arjan
43:28,jbellis,CASSANDRA-5582,jbellis,,Comment,4:230 - 4:236,1,arjan
43:9,what are your thoughts on integrating disruptor at the StorageProxy  a…,CASSANDRA-5582,what are your thoughts on integrating disruptor at the StorageProxy  and MessagingService layer as well? https://issues.apache.org/jira/browse/CASSANDRA-  4718?focusedCommentId=13629447&page=com.atlassian.jira.plugin.system.issuetabpanels:comment-  tabpanel#comment-13629447,,Architectural design configuration,4:249 - 4:522,1,arjan
43:29,tjake,CASSANDRA-5582,tjake,,Comment,4:528 - 4:532,1,arjan
